{"authority":"NONE","authorization":"NONE","catalogue_id":"mathlib-v4.34.1-foundations-v1","catalogue_version":1,"current_applicability":"NOT_CHECKED","extensions":[],"freshness":"PINNED_HISTORICAL_SOURCE","module":{"authority":"NONE","authorization":"NONE","commit":"d13f23b723b8a846827a245b89c10fc7d3f11612","current_applicability":"NOT_CHECKED","freshness":"PINNED_HISTORICAL_SOURCE","module":"Mathlib.Data.Nat.Prime.Basic","module_id":"module-2798a7781bcbb9b344c3a271c7d394c795980de4a56d37f03234d1dab10c1729","path":"Mathlib/Data/Nat/Prime/Basic.lean","repository":"https://github.com/leanprover-community/mathlib4","sha256":"b71a7d5f51c626ae6b70cbe36bab7b77a691f9a214373cfb98e170bd7e6f9aeb","size_bytes":12365,"source_status":"SOURCE_INDEXED","tree":"efa132418a56d0e38c56cc412a06df22178dac5c","verification_status":"NOT_CHECKED"},"objects":[{"authority":"NONE","authorization":"NONE","current_applicability":"NOT_CHECKED","extensions":[],"freshness":"PINNED_HISTORICAL_SOURCE","kind":"theorem","object_contract_version":1,"object_id":"object-17a942e7b8a4a7652a3141c2e03218ec32f9f7a840f1ac274b7c7c8d3c021632","qualified_name":"Nat.Coprime.odd_of_left","source":{"commit":"d13f23b723b8a846827a245b89c10fc7d3f11612","module":"Mathlib.Data.Nat.Prime.Basic","path":"Mathlib/Data/Nat/Prime/Basic.lean","range":{"end":{"byte":6966,"column":90,"line":161},"start":{"byte":6876,"column":0,"line":161}},"repository":"https://github.com/leanprover-community/mathlib4","tree":"efa132418a56d0e38c56cc412a06df22178dac5c"},"source_status":"SOURCE_INDEXED","statement":"∀ {n : Nat},\n  Nat.Coprime (@OfNat.ofNat.{0} Nat (nat_lit 2) (instOfNatNat (nat_lit 2))) n → @Odd.{0} Nat Nat.instSemiring n","statement_sha256":"3a2b47f5184a74bb38b2d177aa9641c0cf0088ba85c9d164473b61bc92f37d27","verification_status":"NOT_CHECKED"},{"authority":"NONE","authorization":"NONE","current_applicability":"NOT_CHECKED","extensions":[],"freshness":"PINNED_HISTORICAL_SOURCE","kind":"theorem","object_contract_version":1,"object_id":"object-f0b1db6dc6e88bf5feb3e51d8a89db50378cab92835d21f849d7ecc4097be3c0","qualified_name":"Nat.Coprime.odd_of_right","source":{"commit":"d13f23b723b8a846827a245b89c10fc7d3f11612","module":"Mathlib.Data.Nat.Prime.Basic","path":"Mathlib/Data/Nat/Prime/Basic.lean","range":{"end":{"byte":7060,"column":93,"line":162},"start":{"byte":6967,"column":0,"line":162}},"repository":"https://github.com/leanprover-community/mathlib4","tree":"efa132418a56d0e38c56cc412a06df22178dac5c"},"source_status":"SOURCE_INDEXED","statement":"∀ {n : Nat}, n.Coprime (@OfNat.ofNat.{0} Nat (nat_lit 2) (instOfNatNat (nat_lit 2))) → @Odd.{0} Nat Nat.instSemiring n","statement_sha256":"a2fa1efbffd5ae98eea15cdf7ceab8bad77a5c2069c6311f8680f836a8604b7e","verification_status":"NOT_CHECKED"},{"authority":"NONE","authorization":"NONE","current_applicability":"NOT_CHECKED","extensions":[],"freshness":"PINNED_HISTORICAL_SOURCE","kind":"theorem","object_contract_version":1,"object_id":"object-3c5d8c380ebfbd953dd8b9831d280005dfaa7820c94a73f76bad49bc7de1d5d1","qualified_name":"Nat.Prime.coprime_pow_of_not_dvd","source":{"commit":"d13f23b723b8a846827a245b89c10fc7d3f11612","module":"Mathlib.Data.Nat.Prime.Basic","path":"Mathlib/Data/Nat/Prime/Basic.lean","range":{"end":{"byte":9010,"column":47,"line":207},"start":{"byte":8858,"column":0,"line":206}},"repository":"https://github.com/leanprover-community/mathlib4","tree":"efa132418a56d0e38c56cc412a06df22178dac5c"},"source_status":"SOURCE_INDEXED","statement":"∀ {p m a : Nat},\n  Nat.Prime p →\n    Not (@Dvd.dvd.{0} Nat Nat.instDvd p a) →\n      a.Coprime\n        (@HPow.hPow.{0, 0, 0} Nat Nat Nat\n          (@instHPow.{0, 0} Nat Nat (@NPow.toPow.{0} Nat (@Monoid.toNPow.{0} Nat Nat.instMonoid))) p m)","statement_sha256":"d1cae2789941077d92a4650e4552803401491c184c8f0e69c2ab2501d5af9b32","verification_status":"NOT_CHECKED"},{"authority":"NONE","authorization":"NONE","current_applicability":"NOT_CHECKED","extensions":[],"freshness":"PINNED_HISTORICAL_SOURCE","kind":"theorem","object_contract_version":1,"object_id":"object-45d8bc32eb789482c0b1f574b7307c7f791c66fc163b544f06d30b6e0aeb0606","qualified_name":"Nat.Prime.dvd_iff_eq","source":{"commit":"d13f23b723b8a846827a245b89c10fc7d3f11612","module":"Mathlib.Data.Nat.Prime.Basic","path":"Mathlib/Data/Nat/Prime/Basic.lean","range":{"end":{"byte":1233,"column":24,"line":39},"start":{"byte":971,"column":0,"line":34}},"repository":"https://github.com/leanprover-community/mathlib4","tree":"efa132418a56d0e38c56cc412a06df22178dac5c"},"source_status":"SOURCE_INDEXED","statement":"∀ {p a : Nat},\n  Nat.Prime p →\n    @Ne.{1} Nat a (@OfNat.ofNat.{0} Nat (nat_lit 1) (instOfNatNat (nat_lit 1))) →\n      Iff (@Dvd.dvd.{0} Nat Nat.instDvd a p) (@Eq.{1} Nat p a)","statement_sha256":"91e372c9fc987655dba18214110a0ed3effad34d6a9c4ba0007a43b7203e567d","verification_status":"NOT_CHECKED"},{"authority":"NONE","authorization":"NONE","current_applicability":"NOT_CHECKED","extensions":[],"freshness":"PINNED_HISTORICAL_SOURCE","kind":"theorem","object_contract_version":1,"object_id":"object-d71ee965aef1812981c4bca250e7ec2f6723c7a9b25f838fd1da6e73e1543772","qualified_name":"Nat.Prime.dvd_iff_not_coprime","source":{"commit":"d13f23b723b8a846827a245b89c10fc7d3f11612","module":"Mathlib.Data.Nat.Prime.Basic","path":"Mathlib/Data/Nat/Prime/Basic.lean","range":{"end":{"byte":5496,"column":39,"line":130},"start":{"byte":5365,"column":0,"line":129}},"repository":"https://github.com/leanprover-community/mathlib4","tree":"efa132418a56d0e38c56cc412a06df22178dac5c"},"source_status":"SOURCE_INDEXED","statement":"∀ {p n : Nat}, Nat.Prime p → Iff (@Dvd.dvd.{0} Nat Nat.instDvd p n) (Not (p.Coprime n))","statement_sha256":"d64e08fa8f3557c2fd19aa3a559416b16cf83b7d7db232b09af3875aa9f94688","verification_status":"NOT_CHECKED"},{"authority":"NONE","authorization":"NONE","current_applicability":"NOT_CHECKED","extensions":[],"freshness":"PINNED_HISTORICAL_SOURCE","kind":"theorem","object_contract_version":1,"object_id":"object-1c75e0546d68248e4f7b1714e790688edb34ffe4c21ba7166068ac62024f2cbb","qualified_name":"Nat.Prime.dvd_mul_of_dvd_ne","source":{"commit":"d13f23b723b8a846827a245b89c10fc7d3f11612","module":"Mathlib.Data.Nat.Prime.Basic","path":"Mathlib/Data/Nat/Prime/Basic.lean","range":{"end":{"byte":10469,"column":73,"line":235},"start":{"byte":10240,"column":0,"line":233}},"repository":"https://github.com/leanprover-community/mathlib4","tree":"efa132418a56d0e38c56cc412a06df22178dac5c"},"source_status":"SOURCE_INDEXED","statement":"∀ {p1 p2 n : Nat},\n  @Ne.{1} Nat p1 p2 →\n    Nat.Prime p1 →\n      Nat.Prime p2 →\n        @Dvd.dvd.{0} Nat Nat.instDvd p1 n →\n          @Dvd.dvd.{0} Nat Nat.instDvd p2 n →\n            @Dvd.dvd.{0} Nat Nat.instDvd (@HMul.hMul.{0, 0, 0} Nat Nat Nat (@instHMul.{0} Nat instMulNat) p1 p2) n","statement_sha256":"c25d058d0a7a380ce98af6909f4b8329839c4da8048349328a0b74e8ed8729e6","verification_status":"NOT_CHECKED"},{"authority":"NONE","authorization":"NONE","current_applicability":"NOT_CHECKED","extensions":[],"freshness":"PINNED_HISTORICAL_SOURCE","kind":"theorem","object_contract_version":1,"object_id":"object-46960ee72f42df2474095f781cdfe93f5e4cdf39c362b08533c8860320abefe1","qualified_name":"Nat.Prime.dvd_of_dvd_pow","source":{"commit":"d13f23b723b8a846827a245b89c10fc7d3f11612","module":"Mathlib.Data.Nat.Prime.Basic","path":"Mathlib/Data/Nat/Prime/Basic.lean","range":{"end":{"byte":7178,"column":27,"line":165},"start":{"byte":7062,"column":0,"line":164}},"repository":"https://github.com/leanprover-community/mathlib4","tree":"efa132418a56d0e38c56cc412a06df22178dac5c"},"source_status":"SOURCE_INDEXED","statement":"∀ {p m n : Nat},\n  Nat.Prime p →\n    @Dvd.dvd.{0} Nat Nat.instDvd p\n        (@HPow.hPow.{0, 0, 0} Nat Nat Nat\n          (@instHPow.{0, 0} Nat Nat (@NPow.toPow.{0} Nat (@Monoid.toNPow.{0} Nat Nat.instMonoid))) m n) →\n      @Dvd.dvd.{0} Nat Nat.instDvd p m","statement_sha256":"ac5a9e789c17accda119df119e80e427a807930246e5db9ee97c17542687f8e6","verification_status":"NOT_CHECKED"},{"authority":"NONE","authorization":"NONE","current_applicability":"NOT_CHECKED","extensions":[],"freshness":"PINNED_HISTORICAL_SOURCE","kind":"theorem","object_contract_version":1,"object_id":"object-a06b93ecd90f306e4f4a693aec343b4162061f377ec5de418a4cee1bddeff0a0","qualified_name":"Nat.Prime.eq_one_of_pow","source":{"commit":"d13f23b723b8a846827a245b89c10fc7d3f11612","module":"Mathlib.Data.Nat.Prime.Basic","path":"Mathlib/Data/Nat/Prime/Basic.lean","range":{"end":{"byte":7512,"column":39,"line":174},"start":{"byte":7402,"column":0,"line":173}},"repository":"https://github.com/leanprover-community/mathlib4","tree":"efa132418a56d0e38c56cc412a06df22178dac5c"},"source_status":"SOURCE_INDEXED","statement":"∀ {x n : Nat},\n  Nat.Prime\n      (@HPow.hPow.{0, 0, 0} Nat Nat Nat\n        (@instHPow.{0, 0} Nat Nat (@NPow.toPow.{0} Nat (@Monoid.toNPow.{0} Nat Nat.instMonoid))) x n) →\n    @Eq.{1} Nat n (@OfNat.ofNat.{0} Nat (nat_lit 1) (instOfNatNat (nat_lit 1)))","statement_sha256":"51e42d777dcf14115a8182390df0c05ea2bc7bdcb0d1d6f1eae5fb5e4dc9dec1","verification_status":"NOT_CHECKED"},{"authority":"NONE","authorization":"NONE","current_applicability":"NOT_CHECKED","extensions":[],"freshness":"PINNED_HISTORICAL_SOURCE","kind":"theorem","object_contract_version":1,"object_id":"object-d39f351caae4fa829f5094b73992ceac21f61312a28ddde73fdeca83cc16cd1a","qualified_name":"Nat.Prime.eq_two_or_odd","source":{"commit":"d13f23b723b8a846827a245b89c10fc7d3f11612","module":"Mathlib.Data.Nat.Prime.Basic","path":"Mathlib/Data/Nat/Prime/Basic.lean","range":{"end":{"byte":1445,"column":87,"line":43},"start":{"byte":1235,"column":0,"line":41}},"repository":"https://github.com/leanprover-community/mathlib4","tree":"efa132418a56d0e38c56cc412a06df22178dac5c"},"source_status":"SOURCE_INDEXED","statement":"∀ {p : Nat},\n  Nat.Prime p →\n    Or (@Eq.{1} Nat p (@OfNat.ofNat.{0} Nat (nat_lit 2) (instOfNatNat (nat_lit 2))))\n      (@Eq.{1} Nat\n        (@HMod.hMod.{0, 0, 0}